[0.036s] Invoking command in '/home/daxton/ros2_beginning/build/turtlesim': AMENT_PREFIX_PATH=/home/daxton/ros2_beginning/install/turtlesim:${AMENT_PREFIX_PATH} CMAKE_PREFIX_PATH=/home/daxton/ros2_beginning/install/turtlesim:${CMAKE_PREFIX_PATH} DEBUGINFOD_URLS=https://debuginfod.ubuntu.com LD_LIBRARY_PATH=/home/daxton/ros2_beginning/install/turtlesim/lib:${LD_LIBRARY_PATH} PYTHONPATH=/home/daxton/ros2_beginning/install/turtlesim/lib/python3.12/site-packages:${PYTHONPATH} /usr/bin/ctest -C Release -D ExperimentalTest --no-compress-output -V --force-new-ctest-process
[0.048s] UpdateCTestConfiguration  from :/home/daxton/ros2_beginning/build/turtlesim/CTestConfiguration.ini
[0.048s] Parse Config file:/home/daxton/ros2_beginning/build/turtlesim/CTestConfiguration.ini
[0.048s]    Site: DaxtonPC
[0.048s]    Build name: (empty)
[0.049s]  Add coverage exclude regular expressions.
[0.049s] Create new tag: 20250524-2045 - Experimental
[0.049s] UpdateCTestConfiguration  from :/home/daxton/ros2_beginning/build/turtlesim/CTestConfiguration.ini
[0.049s] Parse Config file:/home/daxton/ros2_beginning/build/turtlesim/CTestConfiguration.ini
[0.049s] Test project /home/daxton/ros2_beginning/build/turtlesim
[0.049s] Constructing a list of tests
[0.049s] Done constructing a list of tests
[0.050s] Updating test list for fixtures
[0.050s] Added 0 tests to meet fixture requirements
[0.050s] Checking test dependency graph...
[0.050s] Checking test dependency graph end
[0.050s] test 1
[0.050s]     Start 1: copyright
[0.050s] 
[0.051s] 1: Test command: /usr/bin/python3 "-u" "/opt/ros/jazzy/share/ament_cmake_test/cmake/run_test.py" "/home/daxton/ros2_beginning/build/turtlesim/test_results/turtlesim/copyright.xunit.xml" "--package-name" "turtlesim" "--output-file" "/home/daxton/ros2_beginning/build/turtlesim/ament_copyright/copyright.txt" "--command" "/opt/ros/jazzy/bin/ament_copyright" "--xunit-file" "/home/daxton/ros2_beginning/build/turtlesim/test_results/turtlesim/copyright.xunit.xml"
[0.051s] 1: Working Directory: /home/daxton/ros2_beginning/src/ros_tutorials/turtlesim
[0.051s] 1: Test timeout computed to be: 200
[0.132s] 1: -- run_test.py: invoking following command in '/home/daxton/ros2_beginning/src/ros_tutorials/turtlesim':
[0.132s] 1:  - /opt/ros/jazzy/bin/ament_copyright --xunit-file /home/daxton/ros2_beginning/build/turtlesim/test_results/turtlesim/copyright.xunit.xml
[0.679s] 1: No problems found, checked 11 files
[0.696s] 1: -- run_test.py: return code 0
[0.697s] 1: -- run_test.py: verify result file '/home/daxton/ros2_beginning/build/turtlesim/test_results/turtlesim/copyright.xunit.xml'
[0.711s] 1/8 Test #1: copyright ........................   Passed    0.66 sec
[0.712s] test 2
[0.712s]     Start 2: cppcheck
[0.712s] 
[0.712s] 2: Test command: /usr/bin/python3 "-u" "/opt/ros/jazzy/share/ament_cmake_test/cmake/run_test.py" "/home/daxton/ros2_beginning/build/turtlesim/test_results/turtlesim/cppcheck.xunit.xml" "--package-name" "turtlesim" "--output-file" "/home/daxton/ros2_beginning/build/turtlesim/ament_cppcheck/cppcheck.txt" "--command" "/opt/ros/jazzy/bin/ament_cppcheck" "--xunit-file" "/home/daxton/ros2_beginning/build/turtlesim/test_results/turtlesim/cppcheck.xunit.xml" "--include_dirs" "/home/daxton/ros2_beginning/src/ros_tutorials/turtlesim/include"
[0.712s] 2: Working Directory: /home/daxton/ros2_beginning/src/ros_tutorials/turtlesim
[0.712s] 2: Test timeout computed to be: 300
[0.792s] 2: -- run_test.py: invoking following command in '/home/daxton/ros2_beginning/src/ros_tutorials/turtlesim':
[0.792s] 2:  - /opt/ros/jazzy/bin/ament_cppcheck --xunit-file /home/daxton/ros2_beginning/build/turtlesim/test_results/turtlesim/cppcheck.xunit.xml --include_dirs /home/daxton/ros2_beginning/src/ros_tutorials/turtlesim/include
[0.894s] 2: cppcheck 2.13.0 has known performance issues and therefore will not be used, set the AMENT_CPPCHECK_ALLOW_SLOW_VERSIONS environment variable to override this.
[0.916s] 2: -- run_test.py: return code 0
[0.917s] 2: -- run_test.py: verify result file '/home/daxton/ros2_beginning/build/turtlesim/test_results/turtlesim/cppcheck.xunit.xml'
[0.931s] 2/8 Test #2: cppcheck .........................   Passed    0.22 sec
[0.931s] test 3
[0.931s]     Start 3: cpplint
[0.932s] 
[0.932s] 3: Test command: /usr/bin/python3 "-u" "/opt/ros/jazzy/share/ament_cmake_test/cmake/run_test.py" "/home/daxton/ros2_beginning/build/turtlesim/test_results/turtlesim/cpplint.xunit.xml" "--package-name" "turtlesim" "--output-file" "/home/daxton/ros2_beginning/build/turtlesim/ament_cpplint/cpplint.txt" "--command" "/opt/ros/jazzy/bin/ament_cpplint" "--xunit-file" "/home/daxton/ros2_beginning/build/turtlesim/test_results/turtlesim/cpplint.xunit.xml"
[0.932s] 3: Working Directory: /home/daxton/ros2_beginning/src/ros_tutorials/turtlesim
[0.932s] 3: Test timeout computed to be: 120
[1.010s] 3: -- run_test.py: invoking following command in '/home/daxton/ros2_beginning/src/ros_tutorials/turtlesim':
[1.010s] 3:  - /opt/ros/jazzy/bin/ament_cpplint --xunit-file /home/daxton/ros2_beginning/build/turtlesim/test_results/turtlesim/cpplint.xunit.xml
[1.397s] 3: Using '--root=..' argument
[1.397s] 3: 
[1.397s] 3: Done processing /home/daxton/ros2_beginning/src/ros_tutorials/turtlesim/tutorials/draw_square.cpp
[1.397s] 3: 
[1.397s] 3: Done processing /home/daxton/ros2_beginning/src/ros_tutorials/turtlesim/tutorials/mimic.cpp
[1.397s] 3: 
[1.397s] 3: Done processing /home/daxton/ros2_beginning/src/ros_tutorials/turtlesim/tutorials/teleop_turtle_key.cpp
[1.397s] 3: 
[1.397s] 3: Using '--root=/home/daxton/ros2_beginning/src/ros_tutorials/turtlesim/include' argument
[1.397s] 3: 
[1.397s] 3: Done processing /home/daxton/ros2_beginning/src/ros_tutorials/turtlesim/include/turtlesim/qos.hpp
[1.397s] 3: 
[1.397s] 3: Done processing /home/daxton/ros2_beginning/src/ros_tutorials/turtlesim/include/turtlesim/turtle.hpp
[1.397s] 3: 
[1.397s] 3: Done processing /home/daxton/ros2_beginning/src/ros_tutorials/turtlesim/include/turtlesim/turtle_frame.hpp
[1.398s] 3: 
[1.398s] 3: Using '--root=/home/daxton/ros2_beginning/src/ros_tutorials/turtlesim/src' argument
[1.398s] 3: 
[1.398s] 3: Done processing /home/daxton/ros2_beginning/src/ros_tutorials/turtlesim/src/turtle.cpp
[1.398s] 3: 
[1.398s] 3: Done processing /home/daxton/ros2_beginning/src/ros_tutorials/turtlesim/src/turtle_frame.cpp
[1.398s] 3: 
[1.398s] 3: Done processing /home/daxton/ros2_beginning/src/ros_tutorials/turtlesim/src/turtlesim.cpp
[1.398s] 3: 
[1.398s] 3: No problems found
[1.416s] 3: -- run_test.py: return code 0
[1.416s] 3: -- run_test.py: verify result file '/home/daxton/ros2_beginning/build/turtlesim/test_results/turtlesim/cpplint.xunit.xml'
[1.429s] 3/8 Test #3: cpplint ..........................   Passed    0.50 sec
[1.429s] test 4
[1.430s]     Start 4: flake8
[1.430s] 
[1.430s] 4: Test command: /usr/bin/python3 "-u" "/opt/ros/jazzy/share/ament_cmake_test/cmake/run_test.py" "/home/daxton/ros2_beginning/build/turtlesim/test_results/turtlesim/flake8.xunit.xml" "--package-name" "turtlesim" "--output-file" "/home/daxton/ros2_beginning/build/turtlesim/ament_flake8/flake8.txt" "--command" "/opt/ros/jazzy/bin/ament_flake8" "--xunit-file" "/home/daxton/ros2_beginning/build/turtlesim/test_results/turtlesim/flake8.xunit.xml"
[1.430s] 4: Working Directory: /home/daxton/ros2_beginning/src/ros_tutorials/turtlesim
[1.430s] 4: Test timeout computed to be: 60
[1.508s] 4: -- run_test.py: invoking following command in '/home/daxton/ros2_beginning/src/ros_tutorials/turtlesim':
[1.508s] 4:  - /opt/ros/jazzy/bin/ament_flake8 --xunit-file /home/daxton/ros2_beginning/build/turtlesim/test_results/turtlesim/flake8.xunit.xml
[1.789s] 4: 
[1.789s] 4: 2 files checked
[1.790s] 4: No problems found
[1.790s] 4: 
[1.790s] 4: Checked files:
[1.790s] 4: 
[1.790s] 4: * ./launch/multisim.launch.py
[1.790s] 4: * ./src/turtlesim/__init__.py
[1.847s] 4: -- run_test.py: return code 0
[1.847s] 4: -- run_test.py: verify result file '/home/daxton/ros2_beginning/build/turtlesim/test_results/turtlesim/flake8.xunit.xml'
[1.861s] 4/8 Test #4: flake8 ...........................   Passed    0.43 sec
[1.861s] test 5
[1.862s]     Start 5: lint_cmake
[1.862s] 
[1.862s] 5: Test command: /usr/bin/python3 "-u" "/opt/ros/jazzy/share/ament_cmake_test/cmake/run_test.py" "/home/daxton/ros2_beginning/build/turtlesim/test_results/turtlesim/lint_cmake.xunit.xml" "--package-name" "turtlesim" "--output-file" "/home/daxton/ros2_beginning/build/turtlesim/ament_lint_cmake/lint_cmake.txt" "--command" "/opt/ros/jazzy/bin/ament_lint_cmake" "--xunit-file" "/home/daxton/ros2_beginning/build/turtlesim/test_results/turtlesim/lint_cmake.xunit.xml"
[1.862s] 5: Working Directory: /home/daxton/ros2_beginning/src/ros_tutorials/turtlesim
[1.862s] 5: Test timeout computed to be: 60
[1.945s] 5: -- run_test.py: invoking following command in '/home/daxton/ros2_beginning/src/ros_tutorials/turtlesim':
[1.945s] 5:  - /opt/ros/jazzy/bin/ament_lint_cmake --xunit-file /home/daxton/ros2_beginning/build/turtlesim/test_results/turtlesim/lint_cmake.xunit.xml
[2.042s] 5: 
[2.042s] 5: No problems found
[2.058s] 5: -- run_test.py: return code 0
[2.058s] 5: -- run_test.py: verify result file '/home/daxton/ros2_beginning/build/turtlesim/test_results/turtlesim/lint_cmake.xunit.xml'
[2.074s] 5/8 Test #5: lint_cmake .......................   Passed    0.21 sec
[2.074s] test 6
[2.074s]     Start 6: pep257
[2.074s] 
[2.074s] 6: Test command: /usr/bin/python3 "-u" "/opt/ros/jazzy/share/ament_cmake_test/cmake/run_test.py" "/home/daxton/ros2_beginning/build/turtlesim/test_results/turtlesim/pep257.xunit.xml" "--package-name" "turtlesim" "--output-file" "/home/daxton/ros2_beginning/build/turtlesim/ament_pep257/pep257.txt" "--command" "/opt/ros/jazzy/bin/ament_pep257" "--xunit-file" "/home/daxton/ros2_beginning/build/turtlesim/test_results/turtlesim/pep257.xunit.xml"
[2.074s] 6: Working Directory: /home/daxton/ros2_beginning/src/ros_tutorials/turtlesim
[2.075s] 6: Test timeout computed to be: 60
[2.159s] 6: -- run_test.py: invoking following command in '/home/daxton/ros2_beginning/src/ros_tutorials/turtlesim':
[2.159s] 6:  - /opt/ros/jazzy/bin/ament_pep257 --xunit-file /home/daxton/ros2_beginning/build/turtlesim/test_results/turtlesim/pep257.xunit.xml
[2.302s] 6: checking ./launch/multisim.launch.py
[2.302s] 6: checking ./src/turtlesim/__init__.py
[2.302s] 6: No problems found
[2.329s] 6: -- run_test.py: return code 0
[2.329s] 6: -- run_test.py: verify result file '/home/daxton/ros2_beginning/build/turtlesim/test_results/turtlesim/pep257.xunit.xml'
[2.342s] 6/8 Test #6: pep257 ...........................   Passed    0.27 sec
[2.343s] test 7
[2.343s]     Start 7: uncrustify
[2.343s] 
[2.343s] 7: Test command: /usr/bin/python3 "-u" "/opt/ros/jazzy/share/ament_cmake_test/cmake/run_test.py" "/home/daxton/ros2_beginning/build/turtlesim/test_results/turtlesim/uncrustify.xunit.xml" "--package-name" "turtlesim" "--output-file" "/home/daxton/ros2_beginning/build/turtlesim/ament_uncrustify/uncrustify.txt" "--command" "/opt/ros/jazzy/bin/ament_uncrustify" "--xunit-file" "/home/daxton/ros2_beginning/build/turtlesim/test_results/turtlesim/uncrustify.xunit.xml"
[2.343s] 7: Working Directory: /home/daxton/ros2_beginning/src/ros_tutorials/turtlesim
[2.343s] 7: Test timeout computed to be: 60
[2.425s] 7: -- run_test.py: invoking following command in '/home/daxton/ros2_beginning/src/ros_tutorials/turtlesim':
[2.425s] 7:  - /opt/ros/jazzy/bin/ament_uncrustify --xunit-file /home/daxton/ros2_beginning/build/turtlesim/test_results/turtlesim/uncrustify.xunit.xml
[2.580s] 7: No code style divergence in file 'include/turtlesim/qos.hpp'
[2.580s] 7: 
[2.580s] 7: No code style divergence in file 'include/turtlesim/turtle.hpp'
[2.580s] 7: 
[2.580s] 7: No code style divergence in file 'include/turtlesim/turtle_frame.hpp'
[2.580s] 7: 
[2.580s] 7: No code style divergence in file 'src/turtle.cpp'
[2.580s] 7: 
[2.581s] 7: No code style divergence in file 'src/turtle_frame.cpp'
[2.581s] 7: 
[2.581s] 7: No code style divergence in file 'src/turtlesim.cpp'
[2.581s] 7: 
[2.581s] 7: No code style divergence in file 'tutorials/draw_square.cpp'
[2.581s] 7: 
[2.581s] 7: No code style divergence in file 'tutorials/mimic.cpp'
[2.581s] 7: 
[2.581s] 7: No code style divergence in file 'tutorials/teleop_turtle_key.cpp'
[2.582s] 7: 
[2.582s] 7: No problems found
[2.598s] 7: -- run_test.py: return code 0
[2.598s] 7: -- run_test.py: verify result file '/home/daxton/ros2_beginning/build/turtlesim/test_results/turtlesim/uncrustify.xunit.xml'
[2.613s] 7/8 Test #7: uncrustify .......................   Passed    0.27 sec
[2.613s] test 8
[2.613s]     Start 8: xmllint
[2.613s] 
[2.614s] 8: Test command: /usr/bin/python3 "-u" "/opt/ros/jazzy/share/ament_cmake_test/cmake/run_test.py" "/home/daxton/ros2_beginning/build/turtlesim/test_results/turtlesim/xmllint.xunit.xml" "--package-name" "turtlesim" "--output-file" "/home/daxton/ros2_beginning/build/turtlesim/ament_xmllint/xmllint.txt" "--command" "/opt/ros/jazzy/bin/ament_xmllint" "--xunit-file" "/home/daxton/ros2_beginning/build/turtlesim/test_results/turtlesim/xmllint.xunit.xml"
[2.614s] 8: Working Directory: /home/daxton/ros2_beginning/src/ros_tutorials/turtlesim
[2.614s] 8: Test timeout computed to be: 60
[2.699s] 8: -- run_test.py: invoking following command in '/home/daxton/ros2_beginning/src/ros_tutorials/turtlesim':
[2.699s] 8:  - /opt/ros/jazzy/bin/ament_xmllint --xunit-file /home/daxton/ros2_beginning/build/turtlesim/test_results/turtlesim/xmllint.xunit.xml
[3.617s] 8: File 'package.xml' is valid
[3.618s] 8: 
[3.618s] 8: No problems found
[3.641s] 8: -- run_test.py: return code 0
[3.641s] 8: -- run_test.py: verify result file '/home/daxton/ros2_beginning/build/turtlesim/test_results/turtlesim/xmllint.xunit.xml'
[3.657s] 8/8 Test #8: xmllint ..........................   Passed    1.04 sec
[3.657s] 
[3.658s] [0;32m100% tests passed[0;0m, 0 tests failed[0;0m out of 8
[3.658s] 
[3.658s] Label Time Summary:
[3.658s] copyright     =   0.66 sec*proc (1 test)
[3.658s] cppcheck      =   0.22 sec*proc (1 test)
[3.658s] cpplint       =   0.50 sec*proc (1 test)
[3.658s] flake8        =   0.43 sec*proc (1 test)
[3.659s] lint_cmake    =   0.21 sec*proc (1 test)
[3.659s] linter        =   3.60 sec*proc (8 tests)
[3.659s] pep257        =   0.27 sec*proc (1 test)
[3.659s] uncrustify    =   0.27 sec*proc (1 test)
[3.659s] xmllint       =   1.04 sec*proc (1 test)
[3.659s] 
[3.659s] Total Test time (real) =   3.61 sec
[3.666s] Invoked command in '/home/daxton/ros2_beginning/build/turtlesim' returned '0': AMENT_PREFIX_PATH=/home/daxton/ros2_beginning/install/turtlesim:${AMENT_PREFIX_PATH} CMAKE_PREFIX_PATH=/home/daxton/ros2_beginning/install/turtlesim:${CMAKE_PREFIX_PATH} DEBUGINFOD_URLS=https://debuginfod.ubuntu.com LD_LIBRARY_PATH=/home/daxton/ros2_beginning/install/turtlesim/lib:${LD_LIBRARY_PATH} PYTHONPATH=/home/daxton/ros2_beginning/install/turtlesim/lib/python3.12/site-packages:${PYTHONPATH} /usr/bin/ctest -C Release -D ExperimentalTest --no-compress-output -V --force-new-ctest-process
